{
  "schema": "ferris.application-readiness-report/v1",
  "report_id": "application-readiness:a2fd49a3b8ae7bccd0e8e98369f324861ed2ce8652d1028a2f51205ffeeee4b3",
  "request_digest": "sha256:84f844114f1c459dca8cac4a530e7146eac83376844dd6285dcd7f6cd9909939",
  "application_id": "ferris.fixture/three-workspace-application",
  "composition_status": "current",
  "diagnostic_code": "FERRIS-APPLICATION-READINESS-CURRENT",
  "aggregate_status": "blocked",
  "workspace_results": [
    {
      "workspace_id": "ferris.fixture/alpha",
      "requirements_digest": "sha256:0ff29f8206abb665d9b2d579306c131a4867f3eb864112c0847f80ac93c39e24",
      "report_id": "report:1111111111111111111111111111111111111111111111111111111111111111",
      "aggregate_status": "ready"
    },
    {
      "workspace_id": "ferris.fixture/beta",
      "requirements_digest": "sha256:7128d9b861ebd246baf928eed2671f4449c6db32f35696edddae63bc9bcb7fcb",
      "report_id": "report:2222222222222222222222222222222222222222222222222222222222222222",
      "aggregate_status": "blocked"
    },
    {
      "workspace_id": "ferris.fixture/gamma",
      "requirements_digest": "sha256:42c4740169b5aeb18aa5d8525288ba35aa6f8aa1ca02f639543ad7ccceed5899",
      "report_id": "report:3333333333333333333333333333333333333333333333333333333333333333",
      "aggregate_status": "ready"
    }
  ],
  "unknowns": [],
  "limitations": [
    "FERRIS-APPLICATION-READINESS-WORKSPACE-ONLY"
  ]
}
